{
  "schema_version": "3.0",
  "paper_id": "UNSEEN-01-RETHINKING-GENERALIZATION",
  "source_sha256": "a71f1294a021cebc6939ec977fc073b6d7b4f183950eba761ec55364d30b729f",
  "created_at": "2026-10-05T14:36:40.669827+00:00",
  "narrative_plan_ref": "model/narrative_plan.json",
  "document": {
    "title": "理解深度学习需要反思泛化理论",
    "subtitle": "从随机标签经验证伪、有限样本表达力定理到传统复杂度界的失效",
    "paper_meta": {
      "authors": [
        "Chiyuan Zhang",
        "Samy Bengio",
        "Moritz Hardt",
        "Benjamin Recht",
        "Oriol Vinyals"
      ],
      "year": 2017,
      "venue": "ICLR (Best Paper Award)",
      "doi": "10.48550/arXiv.1611.03530"
    },
    "sections": [
      {
        "id": "SEC-01",
        "title": "泛化悖论：过参数化现实与经典理论的根本断裂",
        "lead_paragraph": "现代深度学习的空前成功将统计学习理论推向了一场深刻的危机。经典统计学习理论的核心基石建立在“奥卡姆剃刀”与容量控制哲学之上：如果一个假设空间具备容纳甚至记忆任意训练集标签的自由度，那么经验风险最小化（ERM）势必导致灾难性的过拟合，模型将丧失对未见测试分布的预测能力。然而，现代深度卷积神经网络的参数量动辄数倍甚至数十倍于可用训练样本量，却在计算机视觉、语音和自然语言任务上展现出极高的泛化性能。",
        "blocks": [
          {
            "id": "B01-01",
            "type": "paragraph",
            "text": "面对这一显著脱节，过往研究常常诉诸几种定性解释：其一是认为深层神经网络的高度非凸能量曲面（Energy Landscape）构成了一种优化屏障，使得梯度下降无法找到记忆噪声样本的极小值点；其二是认为卷积层、局部连接与权重共享等先验架构强行限制了模型的有效容量；其三是认为数据增强、Dropout 和权重衰减（Weight Decay）等显式正则化手段起到了决定性的约束作用。本文的研究动机正是直面这些假设，通过极具杀伤力的反事实实验设计，系统检验神经网络究竟能否强行记忆纯粹的随机噪声 [p.1, p.2]。",
            "evidence_refs": [
              "p.1",
              "p.2"
            ]
          }
        ]
      },
      {
        "id": "SEC-02",
        "title": "反事实经验证伪：随机化检验与全量噪声记忆",
        "lead_paragraph": "为了从经验上彻底解耦“网络对自然图像语义特征的提取能力”与“网络参数空间的几何记忆容量”，作者借鉴了非参数统计中的随机化检验（Randomization Tests）思想，在 CIFAR-10 和 ImageNet 数据集上设计了一套精密的渐进噪声注入方案。",
        "blocks": [
          {
            "id": "B02-01",
            "type": "figure",
            "evidence_id": "F01",
            "asset": "assets/figures/v3_F01_p4_1254x597.png",
            "caption": "Figure 1：CIFAR-10 上拟合随机标签与随机像素的实验结果。(a) 训练损失随步数的收敛曲线；(b) 达到过拟合所需时间随标签损坏率的变化倍数；(c) 测试误差随标签损坏率的平滑衰减 [F01, p.4]。",
            "evidence_refs": [
              "F01",
              "p.4"
            ]
          },
          {
            "id": "B02-02",
            "type": "paragraph",
            "text": "如图 Figure 1a 所示，无论是真实标签、完全随机赋予的标签、打乱像素还是高斯白噪声像素，Inception 网络在经过约 10k ~ 25k 次梯度下降迭代后，训练交叉熵损失均毫无例外地收敛至 0 [F01, p.4]。最令人震惊的发现记录在 Figure 1b 中：随着标签损坏率从 0.0 逐步提升至 1.0，模型达到 100% 训练精度所需的优化时间仅仅延长了 2 到 4 倍。这意味着梯度下降在毫无统计相关性的纯随机噪声流形上进行经验风险优化时，计算复杂度并没有发生质的跳跃，优化过程依然极其顺畅 [F01, p.4, p.5]。",
            "evidence_refs": [
              "F01",
              "p.4",
              "p.5"
            ]
          },
          {
            "id": "B02-03",
            "type": "table",
            "evidence_id": "T01",
            "asset": "assets/figures/v3_T01_p6_1224x551.png",
            "caption": "Table 1：CIFAR-10 上不同模型在真实标签与随机扰动设置下的训练与测试准确率（%）对比 [T01, p.6]。",
            "evidence_refs": [
              "T01",
              "p.6"
            ]
          },
          {
            "id": "B02-04",
            "type": "paragraph",
            "text": "表 Table 1 的定量数据清晰地表明：Inception 模型在真实标签下达到 100% 训练准确率与 89.05% 测试准确率；而在完全随机标签下，训练准确率依然能够强行达到 100%，而此时测试准确率精确跌落至 10.00%（即十类别均匀随机猜测水准）[T01, p.6]。在 ImageNet 的百万级图像千分类任务上，附录 Table 2 进一步记录了相同的规律：Inception v3 在完全随机标签下依然取得了 91.18% 的 top-1 训练准确率与 97.90% 的 top-5 训练准确率 [T02, p.13]。这一庞大的实验矩阵铁证如山地证明：现代深度架构的有效容量足以完全蛮力记忆整个人类学术规模的基准数据集，任何声称网络本身架构无法拟合噪声的论点均被彻底证伪 [p.2, T01, T02]。",
            "evidence_refs": [
              "p.2",
              "T01",
              "T02",
              "p.13"
            ]
          }
        ]
      },
      {
        "id": "SEC-03",
        "title": "显式正则化的非必要性：调节旋钮而非泛化基石",
        "lead_paragraph": "既然网络架构本身的先验无法阻止全量记忆，那么深度学习的泛化能力是否来源于权重衰减（Weight Decay）、Dropout 或数据增强等显式正则化约束？作者通过系统的剥离实验给出了否定的回答。",
        "blocks": [
          {
            "id": "B03-01",
            "type": "figure",
            "evidence_id": "F02",
            "asset": "assets/figures/v3_F02_p7_1224x750.png",
            "caption": "Figure 2：正则化算子对模型泛化表现的微观影响曲线：(a) ImageNet 上的 Inception；(b) CIFAR-10 上的 Inception [F02, p.7]。",
            "evidence_refs": [
              "F02",
              "p.7"
            ]
          },
          {
            "id": "B03-02",
            "type": "paragraph",
            "text": "在经典凸经验风险最小化框架（如支持向量机与 Ridge 回归）中，正则化是防止模型选择病态插值解的数学必要条件。然而在深度神经网络中，消融实验显示出截然不同的图景（Figure 2 与 Table 1）：当彻底移除数据增强、权重衰减和 Dropout 后，Inception 在 CIFAR-10 上的测试准确率仅从 89.05% 微降至 86.03% [F02, T01, p.6, p.7]。模型在完全没有显式正则化约束的裸机状态下，依然保留了其绝大部分泛化能力；与此同时，显式正则化在面对随机标签时，也完全无法阻止模型达到零训练误差（Table 4）[T04, p.14]。这一对照雄辩地证明：显式正则化充其量只是为最终测试指标增添几个百分点的调优旋钮（Tuning Knobs），既不是控制泛化误差的充分条件，更不是泛化发生的必要条件 [p.2, p.6, T04]。",
            "evidence_refs": [
              "p.2",
              "p.6",
              "p.7",
              "F02",
              "T01",
              "T04",
              "p.14"
            ]
          }
        ]
      },
      {
        "id": "SEC-04",
        "title": "有限样本表达力定理：双层浅网络的任意插值构造",
        "lead_paragraph": "为了杜绝学术界将经验实验归咎于特定优化器技巧或特定卷积参数化的偶发产物，作者在 Section 3 建立了一个极具启发性的纯粹数学理论构造——有限样本表达力定理（Theorem 1）。",
        "blocks": [
          {
            "id": "B04-01",
            "type": "paragraph",
            "text": "【定理 1（有限样本插值能力，p.8）】存在一个深度为 2 的前馈 ReLU 神经网络，输入维度为 d，隐藏层包含 n 个神经元，总参数量仅为 p = 2n + d；对于 d 维实数空间中任意包含 n 个互异样本点的集合 S = {x1, ..., xn} 以及任意目标标量标记 y = (y1, ..., yn)，该网络均能构造性地满足 f(xi) = yi (∀i=1,...,n) [p.8, p.9]。",
            "evidence_refs": [
              "p.8",
              "p.9"
            ]
          },
          {
            "id": "B04-02",
            "type": "paragraph",
            "text": "该定理的证明极为简洁而深刻：首先利用几乎处处存在的随机投影向量 a，将 n 个高维样本点映射为一维实轴上严格单调互异的离散序列 zi = a^T xi；随后令隐层神经元的激活阈值直接与投影点对齐 bi = zi，从而使各隐层神经元计算 ReLU 激活 max{a^T x - bi, 0}。在样本点上的激活矩阵呈现出对角线全为 0 的下三角结构，且其对角线下方的非零元素保证了方程组具有满秩逆矩阵，从而使输出层线性组合权重能够精确求解 [p.8, p.9]。以往关于网络深度的函数空间表达分离理论（如 Telgarsky 与 Eldan-Shamir）均关注紧集上的逼近；而定理 1 严正指出：在样本量有限的真实学习场景下，甚至无需极深的网络，仅需线性参数规模 O(n) 的极简双层网络就足以无损记忆任意标记 [p.3, p.8, p.9]。",
            "evidence_refs": [
              "p.3",
              "p.8",
              "p.9"
            ]
          }
        ]
      },
      {
        "id": "SEC-05",
        "title": "经典复杂度的破产：VC维、Rademacher界与一致收敛的失效",
        "lead_paragraph": "经验拟合事实与有限样本构造定理的结合，向二十世纪统计学习理论的两大基石——Vapnik-Chervonenkis（VC）理论与 Rademacher 复杂度发起了一场降维打击。",
        "blocks": [
          {
            "id": "B05-01",
            "type": "paragraph",
            "text": "根据经典统计学习理论，经验风险与真实风险之间的一致泛化界由经验 Rademacher 复杂度界定：\n$$\\hat{\\mathcal{R}}_S(\\mathcal{H}) = \\mathbb{E}_\\sigma \\left[ \\sup_{h \\in \\mathcal{H}} \\frac{1}{n} \\sum_{i=1}^n \\sigma_i h(x_i) \\right]$$\n在经典理论中，该复杂度度量被用来提供样本量与假设类之间无偏的泛化保证。然而本文的随机标签拟合实验直接证明：对于常用的卷积网络架构类 H，其能够在任意随机标记序列 σ 上实现 0 分类错误，这意味着其经验 Rademacher 复杂度必然满足：\n$$\\hat{\\mathcal{R}}_S(\\mathcal{H}) \\approx 1$$\n当经验复杂度逼近 1 时，所有基于最坏情况一致收敛（Uniform Convergence）的理论上界（包括 VC 维上界与 Rademacher 泛化界）在此假设空间上给出的泛化误差界全部呈现平凡平凡无用（Trivial Bounds, 上界大于 1）[p.9, p.10]。",
            "evidence_refs": [
              "p.9",
              "p.10"
            ]
          },
          {
            "id": "B05-02",
            "type": "paragraph",
            "text": "类似地，算法稳定性理论（Uniform Stability）假设算法在单个训练样本发生替换时输出假设的损失波动受控于 O(1/n)。然而既然网络在扰动一个样本的标签时可以轻易扭曲局部流形去强行拟合，最坏情况下的算法稳定性界同样宣告瓦解。更为深刻的是，附录在核方法（Table 3）上的研究揭示了相似的物理实在：无正则化的核岭回归最小范数插值解同样能达到零训练误差并取得良好的测试准确率，证明过参数化并不必然诱发病态泛化 [T03, p.10, p.14]。",
            "evidence_refs": [
              "T03",
              "p.10",
              "p.14"
            ]
          }
        ]
      },
      {
        "id": "SEC-06",
        "title": "隐式正则化假说与未解的几何前沿",
        "lead_paragraph": "在证伪了经典理论对泛化能力的解释力后，论文将深度学习学术共同体的视线引向了全新的研究范式——优化算法动力学与隐式正则化（Implicit Regularization）。",
        "blocks": [
          {
            "id": "B06-01",
            "type": "paragraph",
            "text": "作者指出，如果模型容量与显式惩罚都无法解释为什么真实数据能泛化而随机数据不能，那么唯一的原动力必定深藏于随机梯度下降（SGD）算法本身的归纳偏置之中。初始化权重分布、梯度的随机游走轨迹以及损失平面的曲率共同构成了一种隐式正则化机制：它引导参数优先向能够利用数据几何相关性的“平坦极小值”或“最小范数解”收敛 [p.2, p.10, p.11]。",
            "evidence_refs": [
              "p.2",
              "p.10",
              "p.11"
            ]
          },
          {
            "id": "B06-02",
            "type": "paragraph",
            "text": "【客观科学边界与作者声称校准】本文的核心学术贡献在于严谨地完成了一场“破局”——它清晰划定了经典最坏情况理论的无效边界，但必须诚实地指出，论文并未（也未声称）建立一套完整的替代性建设理论。论文指认了隐式正则化的存在，但未能给出该隐式正则算子的闭式数学形式，亦未能给出能够在真实网络中直接计算的非平凡泛化界。深度学习泛化的终极奥秘，由此正式从“假设空间的容量度量”迁移至“数据几何、参数化架构与梯度动力学的非凸共生”这一全新的前沿领域 [p.10, p.11]。",
            "evidence_refs": [
              "p.10",
              "p.11"
            ]
          }
        ]
      }
    ]
  }
}
